{
  "$schema": "https://json-schema.org/draft/2020-12/schema",
  "title": "screenshot-automation-runner config",
  "type": "object",
  "required": ["version", "project", "launch", "automation", "output", "scenario"],
  "properties": {
    "version": { "const": 1 },
    "project": { "type": "string", "minLength": 1 },
    "launch": { "type": "object" },
    "automation": { "type": "object" },
    "output": { "type": "object" },
    "scenario": { "type": "object" }
  },
  "additionalProperties": true
}
